{
  "$schema": "http://json-schema.org/draft-07/schema#",
  "$id": "https://work-agent.dev/schemas/agent.schema.json",
  "title": "Agent Specification",
  "description": "Agent configuration defining behavior, model, and tool access",
  "type": "object",
  "required": ["name", "prompt"],
  "properties": {
    "name": {
      "type": "string",
      "description": "Human-readable agent name",
      "minLength": 1,
      "maxLength": 100
    },
    "prompt": {
      "type": "string",
      "description": "System instructions for the agent",
      "minLength": 1
    },
    "model": {
      "type": "string",
      "description": "Bedrock model ID (optional, falls back to defaultModel)"
    },
    "region": {
      "type": "string",
      "description": "AWS region override (optional)",
      "pattern": "^[a-z]{2}-[a-z]+-[0-9]{1}$"
    },
    "guardrails": {
      "type": "object",
      "description": "Model inference parameters",
      "properties": {
        "maxTokens": {
          "type": "integer",
          "minimum": 1,
          "maximum": 100000
        },
        "temperature": {
          "type": "number",
          "minimum": 0,
          "maximum": 2
        },
        "topP": {
          "type": "number",
          "minimum": 0,
          "maximum": 1
        },
        "stopSequences": {
          "type": "array",
          "items": {
            "type": "string"
          }
        }
      },
      "additionalProperties": false
    },
    "tools": {
      "type": "object",
      "description": "Tool configuration",
      "properties": {
        "mcpServers": {
          "type": "array",
          "description": "MCP server IDs to load from catalog",
          "items": {
            "type": "string"
          }
        },
        "available": {
          "type": "array",
          "description": "Tools agent can invoke (supports wildcards, defaults to ['*'])",
          "items": {
            "type": "string"
          }
        },
        "autoApprove": {
          "type": "array",
          "description": "Tools that execute without user confirmation in chat mode",
          "items": {
            "type": "string"
          }
        },
        "aliases": {
          "type": "object",
          "description": "Tool name aliases (alias -> tool ID)",
          "additionalProperties": {
            "type": "string"
          }
        }
      },
      "additionalProperties": false
    },
    "ui": {
      "type": "object",
      "description": "UI customization metadata for desktop application",
      "properties": {
        "component": {
          "type": "string",
          "description": "Identifier for the React workspace component to mount",
          "minLength": 1,
          "maxLength": 120
        },
        "quickPrompts": {
          "type": "array",
          "description": "Predefined prompts rendered as quick action buttons",
          "items": {
            "type": "object",
            "required": ["id", "label", "prompt"],
            "properties": {
              "id": {
                "type": "string",
                "description": "Unique identifier for the quick prompt",
                "minLength": 1,
                "maxLength": 80
              },
              "label": {
                "type": "string",
                "description": "Button label shown in the UI",
                "minLength": 1,
                "maxLength": 60
              },
              "prompt": {
                "type": "string",
                "description": "Plain-text prompt content submitted to the agent",
                "minLength": 1
              }
            },
            "additionalProperties": false
          }
        },
        "workflowShortcuts": {
          "type": "array",
          "description": "Subset of workflows exposed as quick action buttons",
          "items": {
            "type": "string",
            "minLength": 1
          }
        }
      },
      "additionalProperties": false
    },
    "commands": {
      "type": "object",
      "description": "Custom slash commands for the agent",
      "additionalProperties": {
        "type": "object",
        "required": ["name", "description", "prompt"],
        "properties": {
          "name": {
            "type": "string",
            "description": "Command name (without slash)",
            "minLength": 1
          },
          "description": {
            "type": "string",
            "description": "Command description shown in help",
            "minLength": 1
          },
          "prompt": {
            "type": "string",
            "description": "Prompt template to execute",
            "minLength": 1
          },
          "parameters": {
            "type": "string",
            "description": "Optional parameter description"
          },
          "params": {
            "type": "array",
            "description": "Command parameters",
            "items": {
              "type": "object",
              "required": ["name", "description"],
              "properties": {
                "name": {
                  "type": "string"
                },
                "description": {
                  "type": "string"
                },
                "required": {
                  "type": "boolean"
                },
                "default": {
                  "type": "string"
                }
              }
            }
          }
        },
        "additionalProperties": false
      }
    }
  },
  "additionalProperties": false
}
