{
  "name": "Default Assistant",
  "prompt": "You are a helpful AI assistant. Provide clear, concise, and accurate responses to user questions.",
  "model": "anthropic.claude-3-5-sonnet-20240620-v1:0",
  "guardrails": {
    "maxTokens": 4096,
    "temperature": 0.7
  },
  "tools": {
    "mcpServers": [],
    "available": []
  }
}
