{
  "name": "Example Agent",
  "prompt": "You are a helpful assistant with custom commands.",
  "model": "anthropic.claude-3-5-sonnet-20240620-v1:0",
  "guardrails": {
    "maxTokens": 4096,
    "temperature": 0.7
  },
  "tools": {
    "mcpServers": [],
    "available": []
  },
  "commands": {
    "summarize": {
      "name": "summarize",
      "description": "Summarize text or a topic",
      "prompt": "Please provide a concise summary of: {{text}}",
      "params": [
        {
          "name": "text",
          "description": "The text or topic to summarize",
          "required": true
        }
      ]
    },
    "explain": {
      "name": "explain",
      "description": "Explain a concept in simple terms",
      "prompt": "Explain {{concept}} in {{style}} terms",
      "params": [
        {
          "name": "concept",
          "description": "The concept to explain",
          "required": true
        },
        {
          "name": "style",
          "description": "Explanation style (simple, technical, etc.)",
          "required": false,
          "default": "simple"
        }
      ]
    },
    "review": {
      "name": "review",
      "description": "Review code or text",
      "prompt": "Review the following {{type}} and provide feedback:\n\n{{content}}",
      "params": [
        {
          "name": "type",
          "description": "Type of content (code, document, etc.)",
          "required": false,
          "default": "code"
        },
        {
          "name": "content",
          "description": "The content to review",
          "required": true
        }
      ]
    }
  }
}
