{
  "name": "Work Agent",
  "prompt": "You are a helpful AI assistant specialized in software development tasks. You can read and write files, execute commands, and help with coding, debugging, and documentation. Always explain your reasoning and ask for clarification when needed.",
  "guardrails": {
    "maxTokens": 4096,
    "temperature": 0.7
  },
  "ui": {
    "component": "project-stallion-dashboard"
  },
  "model": "us.anthropic.claude-3-7-sonnet-20250219-v1:0",
  "tools": {
    "mcpServers": [
      "files"
    ]
  }
}